<?xml version="1.0" encoding="UTF-8" ?>
<!DOCTYPE xdxf SYSTEM "xdxf_old_schema_rev33.dtd">
<xdxf lang_from="ENG" lang_to="ENG" format="logical" revision="033">
    <meta_info>
        <title>Webster's Dictionary</title>
        <full_title>Webster's Unabridged Dictionary</full_title>
        <description>Webster's Unabridged Dictionary published 1913 by the Webster Institute</description>
        <file_ver>001</file_ver>
        <creation_date>07-04-2013</creation_date>
        <last_edited_date>13-10-2017</last_edited_date>
        <abbreviations>
          <abbr_def><abbr_k>n.</abbr_k><abbr_v>noun</abbr_v></abbr_def>
          <abbr_def><abbr_k>v.</abbr_k><abbr_v>verb</abbr_v></abbr_def>
          <abbr_def><abbr_k>Av.</abbr_k><abbr_k>Ave.</abbr_k><abbr_v>Avenue</abbr_v> </abbr_def>
        </abbreviations>
    </meta_info>
    <lexicon>
        <ar>
            <k>home</k>
            <def>
                <gr><tr>'həum</tr><abbr>n.</abbr> <rref start="16384" size="512" lctn="sounds_of_words.ogg"/></gr>
                <co>XDXF <iref href="http://xdxf.sourceforge.net"><b>Home</b> page</iref></co>
                <def><deftext>One's own dwelling place; the house in which one lives.</deftext></def>
                <def><deftext>One's native land; the place or country in which one dwells.</deftext></def>
                <def>
                    <deftext>The abiding place of the affections.</deftext>
                    <ex><ex_orig>For without hearts there is no home.</ex_orig></ex>
                </def>
                <def>
                    <deftext>
                        <dtrn>дом</dtrn>, at home - дома, у себя;
                    </deftext>
                    <ex>
                        <ex_orig>make yourself at <mrkd>home</mrkd></ex_orig>
                        <ex_tran>будьте как <mrkd>дома</mrkd></ex_tran>
                    </ex>
                    <categ><kref idref="fb982hk">Society</kref></categ>
                </def>
                <sr><kref type="rel">home-made</kref></sr>
            </def>
        </ar>
        <ar f="v">
            <k id="fb982hk">Society</k>
            <def>
                <deftext>Plural form of word <kref>index</kref>.</deftext>
            </def>
        </ar>
        <ar>
            <k>disc</k>
            <k>disk</k>
            <def>
                <gr><abbr>n.</abbr></gr>
                <deftext>A flat, circular plate; as, a disk of metal or paper.</deftext>
            </def>
        </ar>
        <ar>
            <k>CO<sub>2</sub></k>
            <def>
                <deftext>Carbon dioxide (CO<sub>2</sub>) - a heavy odorless gas formed during respiration.</deftext>
            </def>
        </ar>
    </lexicon>
</xdxf>